{
  "$schema": "https://json-schema.org/draft/2020-12/schema",
  "$id": "https://github.com/mcmt/mcmt/schemas/apply_report.schema.json",
  "title": "mcmt apply report",
  "description": "Writer output. Exists because editplan.unwritten only covers refusals the BACKEND made; refusals the WRITER makes (stale node, placeholder residue, external .mcc, unknown compression, list homogeneity failure) previously had no exit and would have been reported only to stderr. Anything not written must be enumerated somewhere machine-readable, or 'it silently did nothing' becomes indistinguishable from success.",
  "type": "object",
  "required": ["format", "schema_version", "outcome", "world", "counts", "unwritten"],
  "additionalProperties": false,
  "properties": {
    "format": { "const": "mcmt-apply-report" },
    "schema_version": { "type": "integer", "const": 4 },
    "generated_at": { "type": "string", "format": "date-time" },

    "outcome": {
      "type": "string",
      "enum": ["applied", "dry_run", "aborted", "rolled_back"],
      "description": "aborted: refused before touching anything. rolled_back: a failure occurred mid-write and every protected file was restored from the backup set."
    },

    "world": {
      "type": "object",
      "required": ["path", "world_fingerprint_before"],
      "additionalProperties": false,
      "properties": {
        "path": { "type": "string" },
        "world_fingerprint_before": { "type": "string" },
        "world_fingerprint_after": { "type": ["string", "null"] },
        "extract_fingerprint": { "type": ["string", "null"] }
      }
    },

    "backup": {
      "type": ["object", "null"],
      "required": ["directory", "file_count"],
      "additionalProperties": false,
      "description": "Null only when outcome is dry_run or aborted-before-backup. Any other null here is a bug: no write is permitted without a backup.",
      "properties": {
        "directory": { "type": "string", "description": "Absolute path. Printed on every failure path so the user always has a way back." },
        "file_count": { "type": "integer", "minimum": 0 },
        "bytes": { "type": "integer", "minimum": 0 }
      }
    },

    "counts": {
      "type": "object",
      "required": ["edits_planned", "edits_written", "chunks_touched", "chunks_copied_verbatim"],
      "additionalProperties": false,
      "properties": {
        "edits_planned": { "type": "integer", "minimum": 0 },
        "edits_written": { "type": "integer", "minimum": 0 },
        "chunks_touched": { "type": "integer", "minimum": 0 },
        "chunks_copied_verbatim": {
          "type": "integer",
          "minimum": 0,
          "description": "Chunks passed through as their original compressed bytes. Asserting this equals total-minus-touched is the machine-checkable form of the surgical-write rule."
        },
        "files_rewritten": { "type": "integer", "minimum": 0 },
        "list_promotions": {
          "type": "integer",
          "minimum": 0,
          "description": "How many NBT lists were promoted from all-string to all-compound, forcing every sibling element to be rewritten."
        }
      }
    },

    "unwritten": {
      "type": "array",
      "description": "Writer-side refusals. Same {unit_id, reason, detail} shape as editplan.unwritten, disjoint reason vocabulary.",
      "items": {
        "type": "object",
        "required": ["unit_id", "reason"],
        "additionalProperties": false,
        "properties": {
          "unit_id": { "type": "string" },
          "occurrence_id": { "type": ["string", "null"] },
          "reason": {
            "type": "string",
            "enum": [
              "node_changed",
              "node_missing",
              "placeholder_residue",
              "external_mcc_chunk",
              "unknown_compression",
              "list_homogeneity_failed",
              "unsupported_world_structure",
              "unsupported_encoding",
              "chunk_unreadable",
              "oversized_chunk"
            ],
            "description": "node_changed: expected_encoding no longer matches, i.e. the world moved. placeholder_residue: a [[n]] token survived into a literal value. unsupported_world_structure: pre-1.21 chunk layout (Level.TileEntities or Text1..Text4), which v1 refuses rather than half-supports."
          },
          "detail": { "type": "string" }
        }
      }
    },

    "warnings": {
      "type": "array",
      "items": {
        "type": "object",
        "required": ["kind", "detail"],
        "additionalProperties": false,
        "properties": {
          "kind": {
            "type": "string",
            "enum": ["width_overflow", "pack_format_outdated", "lang_key_missing", "duplicate_key", "sector_realignment"]
          },
          "unit_id": { "type": ["string", "null"] },
          "detail": { "type": "string" }
        }
      }
    },

    "assets_installed": {
      "type": "array",
      "items": {
        "type": "object",
        "required": ["source", "destination"],
        "additionalProperties": false,
        "properties": {
          "source": { "type": "string" },
          "destination": { "type": "string" },
          "replaced_existing": { "type": "boolean" },
          "backup_of_replaced": { "type": ["string", "null"] }
        }
      }
    }
  }
}
